{
  "$schema": "http://json-schema.org/draft-06/schema#",
  "title": "Source",
  "description": "Elastic Map Service data source",
  "type": "object",
  "required": [
    "versions",
    "production",
    "attribution",
    "type",
    "data",
    "name",
    "humanReadableName",
    "fieldMapping",
    "weight",
    "emsFormats",
    "createdAt"
  ],
  "additionalProperties": false,
  "properties": {
    "versions": {
      "type": "string",
      "description": "Must be a semver compatible string (ex. v1, 1, 1.0.0, 1.x) or range (ex 1 - 2, ^1.0.1). See more examples at https://www.npmjs.com/package/semver. "
    },
    "production": {
      "type": "boolean",
      "description": "Whether or not the layer should be published to production"
    },
    "type": {
      "type": "string",
      "enum": ["http", "ftp", "ESRI"]
    },
    "data": {
      "type": "string"
    },
    "wikidata": {
      "type": "string",
      "description": "The Wikidata ID of the region type. Used for i18n translations."
    },
    "query": {
      "description": "Query string parameters to append to the data",
      "type": "object"
    },
    "fieldMapping": {
      "description": "Specifies map source field names or properties to elastic map service properties",
      "type": "array",
      "items": { "$ref": "#/definitions/fieldMap" }
    },
    "website": {
      "type": "string"
    },
    "compression": {
      "type": "string",
      "enum": ["zip"]
    },
    "license": {
      "oneOf": [{ "type": "string" }, { "$ref": "#/definitions/license" }]
    },
    "attribution": {
      "type": "array",
      "minItems": 1,
      "items": {
        "$ref": "#/definitions/i18n-attribution"
      },
      "description": "Attribution for map data in different locales when available."
    },
    "id": {
      "description": "Manifest id number. These are used as blob file identifiers in the v1 and v2 manifests.",
      "oneOf": [{ "type": "string" }, { "type": "number" }]
    },
    "ttl": {
      "description": "Time to live (seconds) until we recache the data from the source (unused)",
      "type": "integer"
    },
    "weight": {
      "description": "Weight of layer for ordering. Larger numbers appear higher in order.",
      "type": "integer"
    },
    "name": {
      "description": "Short name for source.",
      "type": "string"
    },
    "createdAt": {
      "description": "Layer creation date in ISO 8601 format.",
      "type": "string"
    },
    "humanReadableName": {
      "description": "Localized human readable names",
      "$ref": "#/definitions/i18n"
    },
    "legacyIds": {
      "description": "Identifying names or ids used in legacy versions of EMS",
      "type": "array",
      "items": {
        "type": "string"
      }
    },
    "sourceFormat": {
      "$ref": "#/definitions/format",
      "description": "GIS file format for data coming from source"
    },
    "emsFormats": {
      "description": "Array of GIS file formats exposed in the Elastic Maps Service manifest",
      "type": "array",
      "items": {
        "$ref": "#/definitions/format"
      },
      "minItems": 1,
      "contains": {
        "description": "Exactly one format must be specified as the default format to use.",
        "type": "object",
        "required": ["default"],
        "properties": {
          "default": {
            "type": "boolean",
            "enum": [true]
          }
        }
      }
    },
    "note": {
      "oneOf": [{ "type": "string" }, { "type": "object" }]
    }
  },
  "definitions": {
    "i18n-attribution": {
      "type": "object",
      "additionalProperties": false,
      "required": ["label"],
      "properties": {
        "url": {
          "$ref": "#/definitions/i18n"
        },
        "label": {
          "$ref": "#/definitions/i18n"
        }
      }
    },
    "i18n": {
      "type": "object",
      "required": ["en"],
      "additionalProperties": {
        "type": "string"
      }
    },
    "license": {
      "type": "object",
      "properties": {
        "url": {
          "type": "string",
          "format": "uri"
        },
        "text": {
          "type": "string"
        },
        "attribution": {
          "type": "boolean"
        },
        "attribution name": {
          "type": "string"
        },
        "share-alike": {
          "type": "boolean"
        }
      }
    },
    "fieldMap": {
      "description": "Specifies type, name, source, destination, and description of a field.",
      "type": "object",
      "required": ["type", "name", "desc"],
      "properties": {
        "type": {
          "description": "Type of field.",
          "type": "string",
          "enum": ["id", "property"]
        },
        "name": {
          "type": "string",
          "description": "Name of field in vector data"
        },
        "desc": {
          "type": "string",
          "description": "Human readable field name"
        }
      }
    },
    "format": {
      "description": "GIS format such as shapefile, geojson, topojson",
      "type": "object",
      "required": [ "type", "file" ],
      "properties": {
        "default": {
          "type": "boolean",
          "description": "When choosing from multiple formats, use this layer by default"
        },
        "type": {
          "type": "string",
          "enum": [
            "geojson",
            "shapefile",
            "gdb",
            "topojson",
            "wkt"
          ]
        },
        "srs": {
          "type": "string",
          "pattern": "EPSG:[0-9]+",
          "description": "Spatial Reference System. Assumed to be EPSG:4326 if not specified."
        },
        "file": {
          "type": "string",
          "description": "File name"
        },
        "layer": {
          "description": "Specifies a layer to use from the given file if necessary",
          "oneOf": [{ "type": "integer" }, { "type": "string" }]
        },
        "meta": {
          "description": "Additional properties that can be used to describe and parse the vector file",
          "type": "object",
          "additionalProperties": true,
          "properties": {
            "feature_collection_path": {
              "type": "string",
              "description": "For TopoJSON files, the value of the member of `objects` to be used. Refer to https://github.com/topojson/topojson-specification#215-objects"
            }
          }
        }
      }
    }
  }
}
