[
  {
    "versions": "2",
    "production": true,
    "attribution": [
      {
        "label": {
          "en": "The Silmarillion"
        }
      }
    ],
    "type": "http",
    "data": "http://example.com",
    "name": "mordor_regions",
    "legacyIds": [ "Mordor" ],
    "humanReadableName": {
      "en": "Mordor Regions",
      "de": "Mordor",
      "zh": "魔多"
    },
    "fieldMapping": [
      {
        "type": "id",
        "name": "wikidata",
        "regex": "^Q[1-9]\\d*",
        "desc": "Wikidata identifier"
      },
      {
        "type": "property",
        "name": "label_en",
        "alias": [ "(geo\\.){0,}region_name" ],
        "desc": "Region name (English)"
      }
    ],
    "weight": 0,
    "id": 111111111111,
    "emsFormats": [{
      "type": "geojson",
      "file": "mordor_regions.json",
      "default": true
    }],
    "createdAt": "1000-01-02T17:12:15.978370"
  },
  {
    "versions": ">=1",
    "production": true,
    "attribution": [
      {
        "label": {
          "en": "The Silmarillion"
        }
      }
    ],
    "type": "http",
    "data": "http://example.com",
    "name": "isengard_regions",
    "legacyIds": [ "Isengard" ],
    "humanReadableName": {
      "en": "Isengard Regions",
      "de": "Isengard",
      "zh": "艾辛格"
    },
    "fieldMapping": [
      {
        "type": "id",
        "name": "wikidata",
        "regex": "^Q[1-9]\\d*",
        "desc": "Wikidata identifier"
      },
      {
        "type": "property",
        "name": "label_en",
        "alias": [ "(geo\\.){0,}region_name" ],
        "desc": "Region name (English)"
      }
    ],
    "weight": 0,
    "id": 111111111111,
    "emsFormats": [{
      "type": "geojson",
      "file": "isengard_v1.geo.json",
      "default": true
    }],
    "createdAt": "1000-01-02T17:12:15.978370"
  }
]
