[
  {
    "versions": "1.x",
    "production": false,
    "attribution": [
      {
        "label": {
          "en": "The Silmarillion"
        }
      }
    ],
    "type": "http",
    "data": "http://example.com",
    "name": "mordor_regions",
    "legacyIds": [ "Mordor" ],
    "humanReadableName": {
      "en": "Mordor Regions",
      "de": "Mordor",
      "zh": "魔多"
    },
    "fieldMapping": [
      {
        "type": "id",
        "name": "wikidata",
        "regex": "^Q[1-9]\\d*",
        "desc": "Wikidata identifier"
      },
      {
        "type": "property",
        "name": "label_en",
        "alias": [ "(geo\\.){0,}region_name" ],
        "desc": "Region name (English)"
      }
    ],
    "weight": 0,
    "id": 111111111111,
    "emsFormats": [{
      "type": "geojson",
      "file": "mordor_v1.geo.json",
      "default": true
    }],
    "createdAt": "1000-01-02T17:12:15.978370"
  },
  {
    "versions": "1 - 2",
    "production": true,
    "attribution": [
      {
        "label": {
          "en": "The Silmarillion"
        },
        "url": {
          "en": "https://en.wikipedia.org/wiki/The_Silmarillion"
        }
      }, {
        "label": {
          "en": "Elastic Maps Service"
        },
        "url": {
          "en": "https://www.elastic.co/elastic-maps-service"
        }
      }
    ],
    "type": "http",
    "data": "http://example.com",
    "name": "gondor",
    "legacyIds": [ "Gondor" ],
    "humanReadableName": {
      "en": "Gondor Kingdoms",
      "de": "Gondor",
      "zh": "魔多"
    },
    "fieldMapping": [
      {
        "type": "id",
        "name": "wikidata",
        "regex": "^Q[1-9]\\d*",
        "desc": "Wikidata identifier"
      },
      {
        "type": "property",
        "name": "label_en",
        "alias": [ "(geo\\.){0,}region_name" ],
        "desc": "Kingdom name (English)"
      }
    ],
    "weight": 0,
    "id": 222222222222,
    "emsFormats": [{
      "type": "geojson",
      "file": "gondor_v2.geo.json",
      "default": true
    }],
    "createdAt": "1200-02-28T17:13:39.288909"
  },
  {
    "versions": ">=3",
    "production": true,
    "attribution": [
      {
        "label": {
          "en": "The Silmarillion",
          "fr": "Le Silmarillion"
        },
        "url": {
          "en": "https://en.wikipedia.org/wiki/The_Silmarillion",
          "fr": "https://fr.wikipedia.org/wiki/Le_Silmarillion"
        }
      }, {
        "label": {
          "en": "Elastic Maps Service"
        },
        "url": {
          "en": "https://www.elastic.co/elastic-maps-service"
        }
      }
    ],
    "type": "http",
    "data": "http://example.com",
    "name": "gondor",
    "legacyIds": [ "Gondor", "Gondor Kingdoms" ],
    "humanReadableName": {
      "en": "Gondor Kingdoms",
      "de": "Gondor",
      "zh": "魔多"
    },
    "fieldMapping": [
      {
        "type": "id",
        "name": "wikidata",
        "regex": "^Q[1-9]\\d*",
        "desc": "Wikidata identifier"
      },
      {
        "type": "property",
        "name": "label_en",
        "alias": [ "(geo\\.){0,}region_name" ],
        "desc": "Kingdom name (English)"
      }
    ],
    "weight": 0,
    "emsFormats": [{
      "type": "geojson",
      "file": "gondor_v3.geo.json",
      "default": true
    }],
    "createdAt": "1200-02-28T17:13:39.288909"
  },
  {
    "versions": ">=2",
    "production": true,
    "attribution": [
      {
        "label": {
          "en": "The Silmarillion"
        }
      }
    ],
    "type": "http",
    "data": "http://example.com",
    "name": "rohan",
    "legacyIds": [ "Rohan", "Rohan Kingdoms" ],
    "humanReadableName": {
      "en": "Rohan Kingdoms",
      "de": "Rohan",
      "zh": "洛汗"
    },
    "fieldMapping": [
      {
        "type": "id",
        "name": "wikidata",
        "regex": "^Q[1-9]\\d*",
        "desc": "Wikidata identifier"
      },
      {
        "type": "property",
        "name": "label_en",
        "alias": [ "(geo\\.){0,}region_name" ],
        "desc": "Kingdom name (English)"
      }
    ],
    "weight": 0,
    "id": 444444444444,
    "emsFormats": [{
      "type": "geojson",
      "file": "rohan_v2.geo.json"
    },{
      "type": "topojson",
      "file": "rohan_v2.topo.json",
      "default": true,
      "meta": {
        "feature_collection_path": "regions"
      }
    }],
    "createdAt": "1200-02-28T17:13:39.456456"
  },
  {
    "versions": ">=2",
    "production": false,
    "attribution": [
      {
        "label": {
          "en": "The Silmarillion"
        }
      }
    ],
    "type": "http",
    "data": "http://example.com",
    "name": "shire",
    "legacyIds": [ "Shire", "Shire regions", "Shire Regions" ],
    "humanReadableName": {
      "en": "Shire regions",
      "de": "Auenland",
      "zh": "夏爾"
    },
    "fieldMapping": [
      {
        "type": "id",
        "name": "wikidata",
        "regex": "^Q[1-9]\\d*",
        "desc": "Wikidata identifier"
      },
      {
        "type": "property",
        "name": "label_en",
        "alias": [ "(geo\\.){0,}region_name" ],
        "desc": "Region name (English)"
      },
      {
        "type": "property",
        "name": "label_ws",
        "desc": "Region name (Westron)"
      }
    ],
    "weight": 0,
    "id": 333333333333,
    "emsFormats": [{
      "type": "geojson",
      "file": "shire_v2.geo.json",
      "default": true
    }, {
      "type": "topojson",
      "file": "shire_v2.topo.json",
      "default": false
    }],
    "createdAt": "1532-12-25T18:45:32.389979"
  }
]
