[
  {
    "versions": ">=1",
    "production": true,
    "attribution": [
      {
        "label": {
          "en": "The Silmarillion"
        }
      }
    ],
    "type": "http",
    "data": "http://example.com",
    "name": "isengard_regions",
    "legacyIds": [ "Isengard" ],
    "humanReadableName": {
      "en": "Isengard Regions",
      "de": "Isengard",
      "zh": "艾辛格"
    },
    "fieldMapping": [
      {
        "type": "id",
        "name": "wikidata",
        "desc": "Wikidata identifier"
      },
      {
        "type": "property",
        "name": "label_en",
        "desc": "Region name (English)"
      }
    ],
    "weight": 0,
    "id": 111111111111,
    "emsFormats": [{
      "type": "geojson",
      "file": "isengard_v1.geo.json",
      "default": true
    }],
    "createdAt": "1000-01-02T17:12:15.978370"
  },
  {
    "versions": "2",
    "production": true,
    "attribution": [
      {
        "label": {
          "en": "The Silmarillion"
        }
      }
    ],
    "type": "http",
    "data": "http://example.com",
    "name": "isengard_regions",
    "legacyIds": [ "Isengard Regions" ],
    "humanReadableName": {
      "en": "Isengard",
      "de": "Isengard",
      "zh": "艾辛格"
    },
    "fieldMapping": [
      {
        "type": "id",
        "name": "wikidata",
        "desc": "Wikidata identifier"
      },
      {
        "type": "property",
        "name": "label_en",
        "desc": "Region name (English)"
      }
    ],
    "weight": 0,
    "id": 222222222222,
    "emsFormats": [{
      "type": "topojson",
      "file": "isengard_v2.topo.json",
      "default": true
    }],
    "createdAt": "1000-01-02T17:12:15.978370"
  },
  {
    "versions": ">=6",
    "production": true,
    "attribution": [
      {
        "label": {
          "en": "The Silmarillion"
        }
      }
    ],
    "type": "http",
    "data": "http://example.com",
    "name": "isengard_regions",
    "legacyIds": [ "Isengard", "Isengard Regions" ],
    "humanReadableName": {
      "en": "Isengard",
      "de": "Isengard",
      "zh": "艾辛格"
    },
    "fieldMapping": [
      {
        "type": "id",
        "name": "wikidata",
        "desc": "Wikidata identifier"
      },
      {
        "type": "property",
        "name": "label_en",
        "desc": "Region name (English)"
      }
    ],
    "weight": 0,
    "id": 333333333333,
    "emsFormats": [{
      "type": "geojson",
      "file": "isengard_v6.geo.json",
      "default": true
    }],
    "createdAt": "1000-01-02T17:12:15.978370"
  }
]
